{
  "schemaVersion": 1,
  "id": "cty_image",
  "type": "taxonomy",
  "axis": "content-type",
  "locale": "zh-CN",
  "slug": "image",
  "name": "图像 Prompt",
  "description": "经过审核、用于生成或转换图像的 Prompt。",
  "status": "published",
  "selector": {"field": "contentType", "value": "image"},
  "translation": {"status": "ready", "reviewer": "example-maintainer"}
}
